Nom_Hotel,Adresse,Nom_Suite,Services,Note,Nbr_Experiences,Periode,Date,Prix
Durrants Hotel,"Westminster, Londres",Chambre Lits Jumeaux,2 lits simples,"8,2",797 expériences vécues,"1 nuit, 1 adulte",,€ 382
London comfy doubles,Londres,Appartement avec Salle de Bains Commune,Hébergement géré par un particulier,"7,2",104 expériences vécues,"1 nuit, 1 adulte",,€ 107
ibis Styles London Gloucester Road,"Kensington et Chelsea, Londres",Chambre Double,1 lit double,"7,9",3 036 expériences vécues,"1 nuit, 1 adulte",,€ 289
NoMad London,"Westminster, Londres",Chambre Classique,1 très grand lit double,"9,2",825 expériences vécues,"1 nuit, 1 adulte",,€ 695
Leonardo Royal Hotel London City - Tower of London,"La City, Londres",Chambre Supérieure avec Lit Double,1 lit double,"8,3",4 767 expériences vécues,"1 nuit, 1 adulte",,€ 393
Canary Wharf Apartments,"Tower Hamlets, Londres",Appartement Deluxe,1 très grand lit double,"4,0",220 expériences vécues,"1 nuit, 1 adulte",,"€ 177€ 151
-15 %"
Holland Inn Hotel,"Kensington et Chelsea, Londres",Chambre Simple,1 lit simple,"5,3",991 expériences vécues,"1 nuit, 1 adulte",,€ 116
Victoria Square,"Westminster, Londres",Chambre Double avec Salle de Bains Commune,1 lit double,"7,2",135 expériences vécues,"1 nuit, 1 adulte",,€ 236
Lovely 1-Bed Studio in London,"Brent, Londres",Studio,1 lit double,"6,2",41 expériences vécues,"1 nuit, 1 adulte",,€ 71
Tower Suites by Blue Orchid,"La City, Londres",Studio Supérieur,Types de lits : 1 lit double ou 2 lits simples,"8,6",6 063 expériences vécues,"1 nuit, 1 adulte",,€ 351
Wombat's City Hostel London,"Tower Hamlets, Londres",Lit dans Dortoir Mixte de 8 Lits ,1 lit superposé,"8,3",5 722 expériences vécues,"1 nuit, 1 adulte",,"€ 87€ 70
-20 %"
Millennium Gloucester Hotel London,"Kensington et Chelsea, Londres",Chambre Double Deluxe,1 lit double,"7,3",11 620 expériences vécues,"1 nuit, 1 adulte",,€ 252
"Holiday Inn Express London Stratford, an IHG Hotel","Newham, Londres",Chambre Double - Non-Fumeurs ,1 grand lit double,"8,4",6 627 expériences vécues,"1 nuit, 1 adulte",,€ 207
Buckle Street Studios by Locke,"Tower Hamlets, Londres",Micro-Studio,1 grand lit double,"8,5",1 611 expériences vécues,"1 nuit, 1 adulte",,€ 284
"The Pond House, Ensuite Rooms - East London Short Let's","Hackney, Londres",Chambre Double avec Salle de Bains Commune,1 lit double,"9,6",73 expériences vécues,"1 nuit, 1 adulte",,€ 141
Studios2Let - North Gower,"Camden, Londres",Studio Économique,1 lit double,"7,2",1 894 expériences vécues,"1 nuit, 1 adulte",,€ 220
Citadines South Kensington London,"Kensington et Chelsea, Londres",Studio,Types de lits : 1 lit double ou 2 lits simples,"7,9",1 504 expériences vécues,"1 nuit, 1 adulte",,€ 330
The Bridge Pub & Rooms,"Barnes, Londres",Chambre Double Confortable,Hébergement géré par un particulier,"8,7",756 expériences vécues,"1 nuit, 1 adulte",,€ 248
"Holiday Inn Express London Limehouse, an IHG Hotel","Tower Hamlets, Londres",Chambre Familiale,"2 lits (1 lit double, 1 canapé-lit)","7,7",5 230 expériences vécues,"1 nuit, 1 adulte",,"€ 438€ 307
-30 %"
Sea Containers London,"Southwark, Londres",Standard,1 lit double,"8,8",8 286 expériences vécues,"1 nuit, 1 adulte",,€ 448
Metro Star,"Newham, Londres",Chambre Simple avec Salle de Bains Commune,1 lit simple,"5,9",304 expériences vécues,"1 nuit, 1 adulte",,€ 92
The Kings Head Hotel,"Acton, Londres",Chambre Deluxe Double ou Lits Jumeaux,Types de lits : 1 lit double ou 2 lits simples,"7,3",1 263 expériences vécues,"1 nuit, 1 adulte",,€ 186
Shakespeare Hotel,"Westminster, Londres",Chambre Lits Jumeaux Standard,2 lits simples,"6,7",1 377 expériences vécues,"1 nuit, 1 adulte",,€ 299
Fenia stay,"Newham, Londres",Chambre Double Deluxe,Hébergement géré par un particulier,"7,7",201 expériences vécues,"1 nuit, 1 adulte",,€ 83
The OMG penthouse,"Lambeth, Londres",Chambre Double avec Lit d'Appoint,Hébergement géré par un particulier,"8,8",4 expériences vécues,"1 nuit, 1 adulte",,€ 233
L'oscar London,"Camden, Londres",Suite Junior,1 très grand lit double,"9,3",284 expériences vécues,"1 nuit, 1 adulte",,€ 1 048
Dukes London,"Westminster, Londres",Chambre Lits Jumeaux Supérieure,2 lits simples,"8,3",469 expériences vécues,"1 nuit, 1 adulte",,€ 623
Novotel London Tower Bridge,"La City, Londres",Chambre Standard avec Lit Queen-Size,1 grand lit double,"8,6",3 784 expériences vécues,"1 nuit, 1 adulte",,€ 350
The Grand at Trafalgar Square,"Westminster, Londres",Chambre Standard Lit Queen-Size,1 grand lit double,"8,1",3 994 expériences vécues,"1 nuit, 1 adulte",,€ 349
City Aldgate Apartments,"Tower Hamlets, Londres",Appartement 1 Chambre,1 grand lit double,"5,1",814 expériences vécues,"1 nuit, 1 adulte",,"€ 205€ 175
-15 %"
Nobu Hotel London Portman Square,"Westminster, Londres",Chambre Lit King-Size Supérieure,1 grand lit double,"8,6",1 466 expériences vécues,"1 nuit, 1 adulte",,€ 580
Rahal Concord,"Newham, Londres",Chambre Double,1 grand lit double,"9,0",2 expériences vécues,"1 nuit, 1 adulte",,€ 67
Three Falcons,"Westminster, Londres",Chambre Double Deluxe avec Douche,1 grand lit double,"8,5",914 expériences vécues,"1 nuit, 1 adulte",,€ 463
Beresford Road London Rooms,"Islington, Londres",Chambre Simple avec Salle de Bains Commune,1 lit simple,"7,0",60 expériences vécues,"1 nuit, 1 adulte",,€ 138
146 Studios,"Westminster, Londres",Studio Double - Sous-Sol,1 lit double,"7,4",2 263 expériences vécues,"1 nuit, 1 adulte",,€ 333
The Electric Vibe,"Lambeth, Londres",Appartement 1 Chambre,1 lit double,"3,7",27 expériences vécues,"1 nuit, 1 adulte",,€ 98
Smart Camden Inn Hostel,"Camden, Londres",Lit Superposé dans Dortoir Mixte,1 lit superposé,"7,8",2 064 expériences vécues,"1 nuit, 1 adulte",,€ 54
The Bull and The Hide,"La City, Londres",Chambre Double Deluxe,1 grand lit double,"8,2",874 expériences vécues,"1 nuit, 1 adulte",,€ 287
Mowbray Court Hotel,"Kensington et Chelsea, Londres",Chambre Simple,1 lit simple,"7,4",3 279 expériences vécues,"1 nuit, 1 adulte",,"€ 338€ 237
-30 %"
Golders Park Hotel,"Golders Green, Londres",Chambre Simple Standard,1 très grand lit double,"5,7",1 179 expériences vécues,"1 nuit, 1 adulte",,€ 98
Single and doubles rooms close to central London,"Lambeth, Londres",Chambre Simple Standard,Hébergement géré par un particulier,"6,0",2 expériences vécues,"1 nuit, 1 adulte",,€ 85
Courthouse Hotel London,"Westminster, Londres",Chambre Double Classique,1 lit double,"6,6",1 192 expériences vécues,"1 nuit, 1 adulte",,€ 371
The Ampersand Hotel,"Kensington et Chelsea, Londres",Chambre Double Deluxe,1 grand lit double,"8,9",2 533 expériences vécues,"1 nuit, 1 adulte",,€ 632
Westbury Hotel Kensington,"Kensington et Chelsea, Londres",Chambre Double,1 lit double,"7,5",2 255 expériences vécues,"1 nuit, 1 adulte",,€ 225
"Hotel DC, Stratford","Newham, Londres",Grande Chambre Double,1 lit double,"8,0",1 496 expériences vécues,"1 nuit, 1 adulte",,€ 219
Cheval Thorney Court at Hyde Park,"Kensington et Chelsea, Londres",Appartement Supérieur 2 Chambres,"2 lits (1 très grand lit double, 1 grand lit double)","9,1",86 expériences vécues,"1 nuit, 1 adulte",,"€ 855€ 770
-10 %"
The Griffin Belle Hotel Vauxhall,"Lambeth, Londres",Chambre Lits Jumeaux avec Salle de Bains Privative,Plusieurs types de lits,"8,8",1 543 expériences vécues,"1 nuit, 1 adulte",,€ 282
Native Bankside,"Southwark, Londres",Studio Premium,1 grand lit double,"9,0",2 308 expériences vécues,"1 nuit, 1 adulte",,€ 301
"Dorset Square Hotel, Firmdale Hotels","Westminster, Londres",Chambre Simple,1 lit simple,"8,6",243 expériences vécues,"1 nuit, 1 adulte",,€ 443
Low budget Room shared bathroom,"Hammersmith and Fulham, Londres",Chambre Double Économique,Hébergement géré par un particulier,"6,8",4 expériences vécues,"1 nuit, 1 adulte",,€ 83
Amazing Studio Apartments Lewisham Way/Greenwich London,"Lewisham, Londres",Studio Standard,1 lit simple,"7,9",10 expériences vécues,"1 nuit, 1 adulte",,€ 115
Transom Close,"Southwark, Londres",Chambre Double avec Salle de Bains Privative,Hébergement géré par un particulier,"9,3",55 expériences vécues,"1 nuit, 1 adulte",,€ 123
Hilton London Angel Islington,"Islington, Londres",Chambre Lit King-Size,1 très grand lit double,"8,0",2 334 expériences vécues,"1 nuit, 1 adulte",,€ 240
London Marriott Hotel Marble Arch,"Westminster, Londres",Chambre Lit King-Size Deluxe,1 très grand lit double,"7,6",1 218 expériences vécues,"1 nuit, 1 adulte",,€ 440
Millennium Hotel London Knightsbridge,"Kensington et Chelsea, Londres",Chambre Simple,1 lit simple,"6,8",3 050 expériences vécues,"1 nuit, 1 adulte",,€ 367
Woodman Pub,Londres,Chambre Lit King-Size,1 grand lit double,"8,5",138 expériences vécues,"1 nuit, 1 adulte",,€ 189
The Level at Melia White House,"Camden, Londres",Chambre Premium The Level,1 très grand lit double,"8,0",120 expériences vécues,"1 nuit, 1 adulte",,"€ 477€ 406
-15 %"
Hyatt Regency London Blackfriars,"La City, Londres",Chambre Lit King-Size - Vue sur High Street,1 très grand lit double,"8,3",63 expériences vécues,"1 nuit, 1 adulte",,€ 598
Kensington Rooms - Warwick Road,"Kensington et Chelsea, Londres",Chambre Double,1 lit double,,"1 nuit, 1 adulte",Taxes et frais compris,,"€ 192€ 163
-15 %"
Umbrella Properties London Woolwich,"Greenwich, Londres",Chambre Deluxe,1 lit double,"7,1",261 expériences vécues,"1 nuit, 1 adulte",,€ 74
The ULH,Londres,Chambre Double Standard avec Salle de Bains Commune,1 lit double,"7,5",87 expériences vécues,"1 nuit, 1 adulte",,€ 153
Sanderson London,"Westminster, Londres",Chambre Double Standard,1 grand lit double,"8,3",1 860 expériences vécues,"1 nuit, 1 adulte",,€ 559
Holmes Hotel London,"Westminster, Londres",Chambre Double,1 lit double,"8,7",1 607 expériences vécues,"1 nuit, 1 adulte",,€ 476
Book A Bed Hostels,"Lewisham, Londres",Chambre Double/Lits Jumeaux,2 lits simples,"6,2",1 068 expériences vécues,"1 nuit, 1 adulte",,€ 114
Leonardo Royal London Tower Bridge,"Tower Hamlets, Londres",Chambre Double Supérieure,1 lit double,"8,1",11 548 expériences vécues,"1 nuit, 1 adulte",,€ 398
The Pilot Inn,"Greenwich, Londres",Chambre Simple,1 lit simple,"8,6",1 374 expériences vécues,"1 nuit, 1 adulte",,€ 258
New Road Hotel,"Tower Hamlets, Londres",Chambre Double Deluxe avec Terrasse,1 grand lit double,"7,9",2 801 expériences vécues,"1 nuit, 1 adulte",,€ 416
Cozy London Flat,"Wandsworth, Londres",Chambre Simple,1 lit simple,10,1 expérience vécue,"1 nuit, 1 adulte",,€ 75
London Stay Apartments,"Southwark, Londres",Chambre Simple,1 lit simple,"7,5",992 expériences vécues,"1 nuit, 1 adulte",,€ 133
"OYO Abbey Hotel, London Shepherd's Bush Market","Hammersmith and Fulham, Londres",Chambre Lits Jumeaux Standard,2 lits simples,"7,1",842 expériences vécues,"1 nuit, 1 adulte",,€ 229
The Franklin London - Starhotels Collezione,"Kensington et Chelsea, Londres",Chambre Simple,1 lit simple,"8,4",433 expériences vécues,"1 nuit, 1 adulte",,€ 571
38 Westerham,Londres,Chambre Double,Hébergement géré par un particulier,,"1 nuit, 1 adulte",Taxes et frais compris,,"€ 112€ 90
-20 %"
Aloft London Excel,"Newham, Londres",Chambre Lit King-Size Aloft,1 très grand lit double,"8,3",4 058 expériences vécues,"1 nuit, 1 adulte",,€ 269
Charlotte Guest House,"Camden, Londres",Studio,1 lit double,"8,0",3 577 expériences vécues,"1 nuit, 1 adulte",,€ 241
Cheval Harrington Court at South Kensington,"Kensington et Chelsea, Londres",Appartement 1 Chambre,1 grand lit double,"9,3",265 expériences vécues,"1 nuit, 1 adulte",,€ 414
Antoinette Hotel Wimbledon,"Wimbledon, Londres",Chambre Double Exécutive,1 très grand lit double,"8,1",1 505 expériences vécues,"1 nuit, 1 adulte",,€ 160
The Exhibitionist Hotel,"Kensington et Chelsea, Londres",Chambre Double Standard,1 grand lit double,"8,4",3 232 expériences vécues,"1 nuit, 1 adulte",,€ 529
Studio9 Rooms,"Islington, Londres",Chambre Lits Jumeaux avec Salle de Bains Commune,2 lits simples,"7,2",133 expériences vécues,"1 nuit, 1 adulte",,€ 179
Sydenham Suites,"Lewisham, Londres",Chambre Double,1 lit double,"5,8",76 expériences vécues,"1 nuit, 1 adulte",,€ 104
Conrad London St James,"Westminster, Londres",Chambre Lit King-Size Deluxe,1 très grand lit double,"8,8",867 expériences vécues,"1 nuit, 1 adulte",,€ 441
"Holiday Inn Express London Greenwich, an IHG Hotel","Greenwich, Londres",Chambre Double,1 lit double,"7,8",6 584 expériences vécues,"1 nuit, 1 adulte",,€ 197
St James Hotel & Club Mayfair,"Westminster, Londres",Chambre Deluxe,1 grand lit double,"8,0",385 expériences vécues,"1 nuit, 1 adulte",,"€ 628€ 578
-8 %"
London Marriott Hotel Grosvenor Square,"Westminster, Londres",Chambre Lit King-Size Deluxe,1 très grand lit double,"7,9",437 expériences vécues,"1 nuit, 1 adulte",,€ 584
The Bryson Hotel,"Camden, Londres",Chambre Double Standard,1 lit double,"7,6",998 expériences vécues,"1 nuit, 1 adulte",,€ 279
The Privacy Annex Balham,"Lambeth, Londres",Suite Familiale Deluxe,"2 lits (1 lit double, 1 lit superposé)",,"1 nuit, 1 adulte",Taxes et frais compris,,€ 124
Cheshire Hotel Central London,"Camden, Londres",Chambre Simple (Sans Fenêtre),1 lit simple,"6,8",733 expériences vécues,"1 nuit, 1 adulte",,€ 258
Treehouse Hotel London,"Westminster, Londres",Chambre Lit King-Size Supérieure,1 très grand lit double,"8,5",765 expériences vécues,"1 nuit, 1 adulte",,€ 580
The Pelham London - Starhotels Collezione,"Kensington et Chelsea, Londres",Chambre Double Deluxe,1 grand lit double,"8,3",532 expériences vécues,"1 nuit, 1 adulte",,€ 594
Lansbury Heritage Hotel,"Tower Hamlets, Londres",Suite Junior,1 grand lit double,"8,8",1 992 expériences vécues,"1 nuit, 1 adulte",,€ 483
Park Avenue J Hotel London Hyde Park,"Westminster, Londres",Chambre Simple,1 lit simple,"7,2",4 290 expériences vécues,"1 nuit, 1 adulte",,"€ 513€ 410
-20 %"
Holland Road Stays,"Kensington et Chelsea, Londres",Studio,Hébergement géré par un particulier,"5,2",265 expériences vécues,"1 nuit, 1 adulte",,€ 219
Summer Road Thames Ditton,Londres,Appartement 2 Chambres,Hébergement géré par un particulier,,"1 nuit, 1 adulte",Taxes et frais compris,,€ 133
Monument Apartments,"La City, Londres",Appartement 1 Chambre,1 grand lit double,"6,6",790 expériences vécues,"1 nuit, 1 adulte",,"€ 270€ 229
-15 %"
Sofitel London St James,"Westminster, Londres",Chambre Lit King-Size Supérieure,1 très grand lit double,"9,2",1 135 expériences vécues,"1 nuit, 1 adulte",,€ 664
The Marble Arch London,"Westminster, Londres",Chambre Simple Deluxe,1 lit simple,"6,3",2 089 expériences vécues,"1 nuit, 1 adulte",,€ 351
F19- Bright Studio for 1 near Paddington,"Westminster, Londres",Studio,1 lit simple,"5,7",18 expériences vécues,"1 nuit, 1 adulte",,€ 110
Umbrella Properties London Excel,"Newham, Londres",Chambre Double,1 très grand lit double,"7,2",391 expériences vécues,"1 nuit, 1 adulte",,€ 91
Canary Riverside Plaza Hotel,"Tower Hamlets, Londres",Chambre Lit King-Size Standard,1 très grand lit double,"8,4",750 expériences vécues,"1 nuit, 1 adulte",,€ 335
The Avonmore Olympia,"Hammersmith and Fulham, Londres",Studio avec Canapé-Lit,"2 lits (1 lit double, 1 canapé-lit)","8,3",370 expériences vécues,"1 nuit, 1 adulte",,€ 334
Novotel London Canary Wharf,"Tower Hamlets, Londres",Chambre Double Supérieure,1 grand lit double,"8,4",4 657 expériences vécues,"1 nuit, 1 adulte",,€ 249
Opulence Boutique Hotel,"Westminster, Londres",Chambre Double,1 lit double,"4,9",237 expériences vécues,"1 nuit, 1 adulte",,€ 415
Thistle London Bloomsbury Park,"Camden, Londres",Chambre Simple Standard,1 lit simple,"6,8",1 419 expériences vécues,"1 nuit, 1 adulte",,€ 250
Arriva Hotel,"Camden, Londres",Chambre Simple,1 lit simple,"6,7",4 561 expériences vécues,"1 nuit, 1 adulte",,€ 228
Hotel du Vin Cannizaro House Wimbledon,"Wimbledon, Londres",Chambre Double Classique,1 grand lit double,"8,0",1 238 expériences vécues,"1 nuit, 1 adulte",,€ 261
"Hux Hotel, Kensington","Kensington et Chelsea, Londres",Chambre Lit King-Size Supérieure,1 grand lit double,"8,4",1 202 expériences vécues,"1 nuit, 1 adulte",,€ 444
Urban Escape Ealing,"Ealing, Londres",Chambre Double,Hébergement géré par un particulier,"8,3",3 expériences vécues,"1 nuit, 1 adulte",,€ 110
"Radisson Blu Edwardian Bond Street Hotel, London","Westminster, Londres",Chambre Simple,1 lit simple,"7,9",4 054 expériences vécues,"1 nuit, 1 adulte",,€ 487
ibis London Docklands Canary Wharf,"Tower Hamlets, Londres",Chambre Double SweetRoom,1 très grand lit double,"7,8",3 716 expériences vécues,"1 nuit, 1 adulte",,€ 235
Stay Saint Paul's,"La City, Londres",Appartement 1 Chambre,"2 lits (1 lit double, 1 canapé-lit)","7,5",37 expériences vécues,"1 nuit, 1 adulte",,€ 395
The Rectory Retreat,"Tower Hamlets, Londres",Chambre Lit Queen-Size avec Salle de Bains Commune ,1 lit double,"6,6",25 expériences vécues,"1 nuit, 1 adulte",,€ 114
The London EDITION,"Westminster, Londres",Chambre 1 Lit Queen-Size Supérieure,1 très grand lit double,"8,5",160 expériences vécues,"1 nuit, 1 adulte",,€ 699
Home away from home,"Islington, Londres",Chambre Deluxe Double ou Lits Jumeaux,2 grands lits doubles,"6,3",445 expériences vécues,"1 nuit, 1 adulte",,€ 225
ibis London Excel-Docklands,"Newham, Londres",Chambre Double Sweet by Ibis,1 lit double,"7,8",3 048 expériences vécues,"1 nuit, 1 adulte",,€ 256
Spacious and homely one bedroom,"Lambeth, Londres",Chambre Double,Hébergement géré par un particulier,"6,5",2 expériences vécues,"1 nuit, 1 adulte",,€ 67
Hyatt Regency London - The Churchill,"Westminster, Londres",Chambre Lit King-Size,1 très grand lit double,"8,5",1 772 expériences vécues,"1 nuit, 1 adulte",,€ 551
The Phoenix Hostel,"Westminster, Londres",Lit Superposé dans Dortoir pour Femmes de 12 Lits,1 lit superposé,"6,6",1 400 expériences vécues,"1 nuit, 1 adulte",,€ 52
Mannbuilding,"Newham, Londres",Chambre Double,1 lit double,"7,9",110 expériences vécues,"1 nuit, 1 adulte",,€ 115
"Club Quarters Hotel Covent Garden Holborn, London","Camden, Londres",Chambre Standard Lit Queen-Size,1 grand lit double,"8,0",3 177 expériences vécues,"1 nuit, 1 adulte",,€ 326
The Rookery,"Islington, Londres",Chambre Double Club,1 lit double,"9,2",604 expériences vécues,"1 nuit, 1 adulte",,€ 425
Sonder Edgware Road,"Westminster, Londres",Chambre Simple,1 lit simple,"7,3",709 expériences vécues,"1 nuit, 1 adulte",,€ 303
St Martins Lane London,"Westminster, Londres",Standard,1 grand lit double,"8,8",4 742 expériences vécues,"1 nuit, 1 adulte",,€ 621
179 church Road,"Brent, Londres",Chambre Double avec Salle de Bains Commune,Hébergement géré par un particulier,"6,5",4 expériences vécues,"1 nuit, 1 adulte",,"€ 114€ 103
-10 %"
The Brompton Hotel,"Kensington et Chelsea, Londres",Chambre Lits Jumeaux,2 lits simples,"5,8",930 expériences vécues,"1 nuit, 1 adulte",,€ 192
Mercure London Paddington Hotel,"Westminster, Londres",Chambre Simple Standard,1 lit simple,"6,4",2 545 expériences vécues,"1 nuit, 1 adulte",,€ 339
LUXE HILL GETAWAY,"Muswell Hill, Londres",Chambre Double avec Salle de Bains Commune,Hébergement géré par un particulier,"8,2",130 expériences vécues,"1 nuit, 1 adulte",,€ 145
Best Western Plus Delmere Hotel,"Westminster, Londres",Chambre Double Cozy,1 lit double,"8,3",1 757 expériences vécues,"1 nuit, 1 adulte",,€ 393
The Stafford London,"Westminster, Londres",Chambre Lit Queen-Size Classique,1 grand lit double,"9,1",1 211 expériences vécues,"1 nuit, 1 adulte",,€ 705
ALTIDO Luxury flats near Big Ben and London Eye,"Westminster, Londres",Maisonnette,2 grands lits doubles,"9,0",29 expériences vécues,"1 nuit, 1 adulte",,"€ 1 719€ 1 501
-13 %"
Luxury 6 Bedroom House with 6 En-suite Bathrooms - West London,Londres,Villa,Hébergement géré par un particulier,10,3 expériences vécues,"1 nuit, 1 adulte",,€ 774
Canary Wharf- South Quay River View Free Wifi Apartment sleeps up to 5,"Tower Hamlets, Londres",Appartement 1 Chambre,"3 lits (1 lit double, 1 lit superposé, 1 canapé-lit)","8,3",8 expériences vécues,"1 nuit, 1 adulte",,€ 818
Premier 3 Bed Lux Apartment - Sleeps 8,"Tower Hamlets, Londres",Appartement 3 Chambres,"4 lits (2 lits doubles, 1 canapé-lit, 1 grand lit double)","5,9",12 expériences vécues,"1 nuit, 1 adulte",,€ 341
The Finsbury Deluxe Apartments,"Islington, Londres",Studio Deluxe,1 lit double,"7,2",136 expériences vécues,"1 nuit, 1 adulte",,€ 284
Luxurious Harrods Penthouse with Stunning Views,"Westminster, Londres",Appartement 2 Chambres,2 grands lits doubles,"7,0",7 expériences vécues,"1 nuit, 1 adulte",,€ 749
The Lyall Residences,"Kensington et Chelsea, Londres",Appartement Supérieur,"4 lits (1 lit double, 1 grand lit double, 2 futons)","6,4",17 expériences vécues,"1 nuit, 1 adulte",,€ 776
Stay Mayfair,"Westminster, Londres",Appartement 2 Chambres,Hébergement géré par un particulier,"7,4",43 expériences vécues,"1 nuit, 1 adulte",,"€ 427€ 395
-7 %"
Soho - Mayfair Luxury Central Apartment,"Westminster, Londres",Appartement 1 Chambre,"2 lits (1 lit double, 1 canapé-lit)","8,0",5 expériences vécues,"1 nuit, 1 adulte",,€ 481
Covent Garden Luxury Apartment,"Westminster, Londres",Appartement 1 Chambre,"2 lits (1 lit double, 1 canapé-lit)","7,1",30 expériences vécues,"1 nuit, 1 adulte",,€ 470
Ennishmore Mews Apartment,"Westminster, Londres",Appartement 1 Chambre,1 lit double,"6,5",11 expériences vécues,"1 nuit, 1 adulte",,€ 375
Boutique 3 Bed Apartment,"Tower Hamlets, Londres",Appartement 3 Chambres,Hébergement géré par un particulier,"2,4",5 expériences vécues,"1 nuit, 1 adulte",,€ 403
The Gatsby Luxury Apartment,"Tower Hamlets, Londres",Appartement 1 Chambre,Hébergement géré par un particulier,"6,8",16 expériences vécues,"1 nuit, 1 adulte",,€ 329
Deluxe Mayfair Luxury Apartment,"Westminster, Londres",Appartement 1 Chambre,Hébergement géré par un particulier,"7,7",12 expériences vécues,"1 nuit, 1 adulte",,€ 568
luxurious 2 bed apartment central London,"Lambeth, Londres",Appartement 2 Chambres,Hébergement géré par un particulier,"7,5",17 expériences vécues,"1 nuit, 1 adulte",,"€ 674€ 573
-15 %"
PenthouseStays Chelsea - Luxury King / Queen Bed Studios - near King's Road,"Kensington et Chelsea, Londres",Studio avec Balcon ,1 grand lit double,"8,2",182 expériences vécues,"1 nuit, 1 adulte",,"€ 402€ 336
-17 %"
"Frankie Says - The Instagood Penthouse, Covent Garden is a floor-to-ceiling glamour puss 3 BR, plus private roof terrace Miaow","Westminster, Londres",Appartement,"4 lits (3 très grands lits doubles, 1 canapé-lit)","9,1",43 expériences vécues,"1 nuit, 1 adulte",,€ 1 391
"Frankie Says - Say hi to the Biggy Smalls, Covent Garden Luxurious 1 BR apartment, a hop and a skip from Leicester Square","Westminster, Londres",Appartement,"2 lits (1 très grand lit double, 1 canapé-lit)","8,8",46 expériences vécues,"1 nuit, 1 adulte",,€ 771
Wilde Aparthotels by Staycity London Paddington,"Westminster, Londres",Studio,1 grand lit double,"9,1",3 844 expériences vécues,"1 nuit, 1 adulte",,€ 347
Wilde Aparthotels by Staycity London Aldgate Tower Bridge,"Tower Hamlets, Londres",Studio Wilde Accessible aux Personnes à Mobilité Réduite,1 grand lit double,"9,1",2 529 expériences vécues,"1 nuit, 1 adulte",,€ 324
Sleepy Joes,"Hackney, Londres",Penthouse,2 très grands lits doubles,"8,9",181 expériences vécues,"1 nuit, 1 adulte",,€ 1 182
Hyatt Place London City East,"Tower Hamlets, Londres",Chambre Lit King-Size - Étage Supérieur,1 très grand lit double,"8,4",3 395 expériences vécues,"1 nuit, 1 adulte",,€ 331
"Modern, peaceful flat in the heart of Wimbledon","Wimbledon, Londres",Appartement 1 Chambre,Hébergement géré par un particulier,"8,5",67 expériences vécues,"1 nuit, 1 adulte",,€ 294
St Johns Wood 3 Bed Executive apartment,"Westminster, Londres",Appartement 3 Chambres,Hébergement géré par un particulier,,"1 nuit, 1 adulte",Taxes et frais compris,,€ 1 971
Aparthotel Adagio London Stratford,"Newham, Londres",Studio,1 lit double,"8,9",3 146 expériences vécues,"1 nuit, 1 adulte",,€ 229
Middle Eight - Preferred Hotels and Resorts,"Camden, Londres",Hébergement Classique Chic,1 très grand lit double,"8,9",3 913 expériences vécues,"1 nuit, 1 adulte",,€ 548
The Perfect inn,"Newham, Londres",Appartement 2 Chambres,Hébergement géré par un particulier,"6,8",392 expériences vécues,"1 nuit, 1 adulte",,€ 460
Tavistock Place Apartments,"Camden, Londres",Appartement 1 Chambre,1 grand lit double,"9,4",43 expériences vécues,"1 nuit, 1 adulte",,€ 631
"3 Bedrooms, 3 Baths, Spacious Lounge, Full Kitchen, Garden, Ground Floor, Free Parking",Londres,Appartement 3 Chambres,"10 lits (6 lits simples, 1 lit double, 3 canapés-lits)","9,6",7 expériences vécues,"1 nuit, 1 adulte",,€ 798
"2 Bedrooms Modern Central London Apartment, Full Kitchen, 5 minutes Tube Station","Tower Hamlets, Londres",Appartement 2 Chambres,"7 lits (5 lits simples, 2 canapés-lits)","8,0",31 expériences vécues,"1 nuit, 1 adulte",,"€ 633€ 538
-15 %"
"Page8, Page Hotels","Westminster, Londres",Chambre Double,1 grand lit double,"9,0",3 978 expériences vécues,"1 nuit, 1 adulte",,"€ 634€ 571
-10 %"
