Nom_Hotel,Adresse,Nom_Suite,Services,Note,Nbr_Experiences,Periode,Date,Prix
"2 Bedrooms Modern Apartment, Lounge, Full Kitchen, Balcony, 5 minutes Stratford Station","Newham, Londres",Appartement 2 Chambres,"6 lits (5 lits simples, 1 canapé-lit)","7,2",48 expériences vécues,"1 nuit, 1 adulte",,€ 362
"4 Bedrooms, 3 Baths, Full Kitchen and Lounge, Garden, Free Parking",Londres,Appartement,"13 lits (8 lits simples, 3 lits doubles, 2 canapés-lits)","7,0",6 expériences vécues,"1 nuit, 1 adulte",,€ 1 099
Destination London Docklands,"Newham, Londres",Maison 4 Chambres,Hébergement géré par un particulier,"7,9",13 expériences vécues,"1 nuit, 1 adulte",,€ 583
Redchurch Townhouse,"Tower Hamlets, Londres",Grande Chambre,1 grand lit double,"9,3",395 expériences vécues,"1 nuit, 1 adulte",,€ 882
CribExtra E14,"Tower Hamlets, Londres",Appartement 1 Chambre,"3 lits (2 lits simples, 1 lit double)","7,0",17 expériences vécues,"1 nuit, 1 adulte",,€ 1 037
2 Bedrooms sleeps 6 - Central London,"Camden, Londres",Appartement 2 Chambres,Hébergement géré par un particulier,"9,1",19 expériences vécues,"1 nuit, 1 adulte",,€ 1 215
"Amazingly Luxurious Loft Apartment, Soho - 3 Bedrooms, 2 Bath & Office","Westminster, Londres",Appartement,"3 lits (2 très grands lits doubles, 1 grand lit double)","9,8",6 expériences vécues,"1 nuit, 1 adulte",,€ 2 292
"Bankside Hotel, Autograph Collection","Southwark, Londres",Hébergement Lit King-Size Modeste,1 très grand lit double,"9,4",504 expériences vécues,"1 nuit, 1 adulte",,€ 489
Lexham Gardens by Cheval Maison,"Kensington et Chelsea, Londres",Appartement Supérieur 1 Chambre,1 très grand lit double,"9,2",273 expériences vécues,"1 nuit, 1 adulte",,€ 556
Buckingham & Lloyds,"Kensington et Chelsea, Londres",Appartement Serpentine,"3 lits (1 lit simple, 2 grands lits doubles)","9,4",321 expériences vécues,"1 nuit, 1 adulte",,"€ 1 036€ 933
-10 %"
Vintry & Mercer,"La City, Londres",Chambre Double Standard,1 grand lit double,"9,4",3 624 expériences vécues,"1 nuit, 1 adulte",,€ 709
London 4 Bedrooms 3 Bathrooms with Garden House,Londres,Appartement 4 Chambres,"13 lits (10 lits simples, 1 lit double, 1 canapé-lit, 1 futon)","7,6",65 expériences vécues,"1 nuit, 1 adulte",,€ 362
Beaufort House - Knightsbridge,"Kensington et Chelsea, Londres",Appartement 1 Chambre Standard,1 grand lit double,"9,1",222 expériences vécues,"1 nuit, 1 adulte",,€ 726
The Apartments by The Sloane Club,"Kensington et Chelsea, Londres",Studio,1 très grand lit double,"9,0",181 expériences vécues,"1 nuit, 1 adulte",,€ 604
Cheval Three Quays at The Tower of London,"La City, Londres",Appartement Supérieur 1 Chambre,1 très grand lit double,"9,4",619 expériences vécues,"1 nuit, 1 adulte",,€ 642
Hotel Cafe Royal,"Westminster, Londres",Chambre Deluxe Lit King-Size ou Lits Jumeaux,"3 lits (2 lits simples, 1 très grand lit double)","9,3",702 expériences vécues,"1 nuit, 1 adulte",,€ 1 084
Native Mayfair,"Westminster, Londres",Appartement 1 Chambre Classique,1 lit double,"9,2",155 expériences vécues,"1 nuit, 1 adulte",,€ 772
"The Wellesley, a Luxury Collection Hotel, Knightsbridge, London","Westminster, Londres",Suite avec Lit King-Size - Vue sur Hyde Park,1 très grand lit double,"9,0",60 expériences vécues,"1 nuit, 1 adulte",,€ 2 171
Fox Connaught London ExCel,"Newham, Londres",Chambre Double Standard,Hébergement géré par un particulier,"6,8",697 expériences vécues,"1 nuit, 1 adulte",,€ 226
Bulgari Hotel London,"Westminster, Londres",Chambre Lit King-Size Supérieure,1 très grand lit double,"9,2",136 expériences vécues,"1 nuit, 1 adulte",,€ 1 867
45 Park Lane - Dorchester Collection,"Westminster, Londres",Chambre Lit King-Size Deluxe,1 très grand lit double,"9,1",38 expériences vécues,"1 nuit, 1 adulte",,€ 1 706
The Prince Akatoki London,"Westminster, Londres",Chambre Double Supérieure,1 grand lit double,"8,9",1 317 expériences vécues,"1 nuit, 1 adulte",,€ 636
Rosewood London,"Camden, Londres",Chambre Lit King-Size Deluxe,1 très grand lit double,"9,1",1 231 expériences vécues,"1 nuit, 1 adulte",,€ 935
"Marriott Executive Apartments London, Canary Wharf","Tower Hamlets, Londres",Studio Lit King-Size,1 très grand lit double,"7,9",65 expériences vécues,"1 nuit, 1 adulte",,€ 396
"St. Ermin's Hotel, Autograph Collection","Westminster, Londres",Chambre Lit Queen-Size,1 grand lit double,"9,1",843 expériences vécues,"1 nuit, 1 adulte",,€ 509
Corinthia London,"Westminster, Londres",Chambre Lit King-Size Supérieure,1 très grand lit double,"9,2",623 expériences vécues,"1 nuit, 1 adulte",,€ 1 347
COMO The Halkin,"Westminster, Londres",Chambre Halkin,1 très grand lit double,"9,1",173 expériences vécues,"1 nuit, 1 adulte",,"€ 1 094€ 875
-20 %"
COMO Metropolitan London,"Westminster, Londres",Chambre Double de Luxe,1 très grand lit double,"8,3",391 expériences vécues,"1 nuit, 1 adulte",,"€ 806€ 645
-20 %"
The Harrington Residences,"Kensington et Chelsea, Londres",Grand Appartement 1 Chambre ,1 lit double,"8,6",2 144 expériences vécues,"1 nuit, 1 adulte",,€ 403
The Resident Kensington,"Kensington et Chelsea, Londres",Chambre Simple,1 lit simple,"8,7",984 expériences vécues,"1 nuit, 1 adulte",,€ 326
"Crowne Plaza London - Docklands, an IHG Hotel","Newham, Londres",Chambre Double Standard avec 2 Lits Doubles,2 lits doubles,"7,9",3 891 expériences vécues,"1 nuit, 1 adulte",,€ 365
"The Biltmore Mayfair, LXR Hotels & Resorts","Westminster, Londres",Chambre Lit King-Size Deluxe,1 très grand lit double,"8,9",564 expériences vécues,"1 nuit, 1 adulte",,€ 809
"Brown's Hotel, a Rocco Forte Hotel","Westminster, Londres",Chambre Lit King-Size/Lits Jumeaux Exécutive,1 très grand lit double,"9,0",163 expériences vécues,"1 nuit, 1 adulte",,€ 1 107
Residence Inn by Marriott London Bridge,"Southwark, Londres",Suite Studio,1 lit double,"8,2",1 152 expériences vécues,"1 nuit, 1 adulte",,€ 388
"The Lanesborough, Oetker Collection","Westminster, Londres",Chambre Deluxe,1 grand lit double,"9,4",196 expériences vécues,"1 nuit, 1 adulte",,€ 1 614
Karma Sanctum Soho Hotel,"Westminster, Londres",Petite Chambre Double,1 très grand lit double,"8,5",465 expériences vécues,"1 nuit, 1 adulte",,€ 536
"Radisson Blu Edwardian Mercer Street Hotel, London","Camden, Londres",Chambre Standard,1 lit double,"8,8",3 688 expériences vécues,"1 nuit, 1 adulte",,€ 576
"The Capital Hotel, Apartments & Townhouse","Kensington et Chelsea, Londres",Chambre Double Classique ,1 très grand lit double,"8,2",1 001 expériences vécues,"1 nuit, 1 adulte",,€ 564
Egerton House,"Kensington et Chelsea, Londres",Chambre Double Classique ,1 lit double,"9,4",721 expériences vécues,"1 nuit, 1 adulte",,"€ 692€ 622
-10 %"
The Westbourne Hyde Park,"Westminster, Londres",Studio Double Deluxe,1 lit double,"8,4",3 506 expériences vécues,"1 nuit, 1 adulte",,€ 476
1 Hotel Mayfair,"Westminster, Londres",Chambre Lit King-Size Supérieure,1 très grand lit double,"9,0",89 expériences vécues,"1 nuit, 1 adulte",,€ 809
"InterContinental London Park Lane, an IHG Hotel","Westminster, Londres",Chambre Cosy,1 très grand lit double,"8,3",506 expériences vécues,"1 nuit, 1 adulte",,€ 875
The Berkeley,"Westminster, Londres",Chambre Berkeley avec Balcon,1 très grand lit double,"9,2",194 expériences vécues,"1 nuit, 1 adulte",,€ 1 625
Residence Inn by Marriott London Tower Bridge,"Southwark, Londres",Studio 1 Lit Double,1 grand lit double,"7,9",1 683 expériences vécues,"1 nuit, 1 adulte",,€ 368
JW Marriott Grosvenor House London,"Westminster, Londres",Chambre Lit Queen-Size Deluxe,1 lit double,"8,2",1 048 expériences vécues,"1 nuit, 1 adulte",,€ 769
London Marriott Hotel Park Lane,"Westminster, Londres",Chambre Deluxe avec 1 Lit King-Size,1 très grand lit double,"8,6",569 expériences vécues,"1 nuit, 1 adulte",,€ 714
Taj 51 Buckingham Gate Suites and Residences,"Westminster, Londres",Suite Junior Kings,1 grand lit double,"9,3",539 expériences vécues,"1 nuit, 1 adulte",,"€ 807€ 686
-15 %"
One Aldwych,"Westminster, Londres",Chambre Lit King-Size Supérieure,Types de lits : 1 lit double ou 2 lits simples,"9,4",664 expériences vécues,"1 nuit, 1 adulte",,€ 1 084
London Hilton on Park Lane,"Westminster, Londres",Suite Mayfair avec Accès au Salon,"2 lits (1 lit double, 1 canapé-lit)","7,8",1 350 expériences vécues,"1 nuit, 1 adulte",,€ 1 122
The Athenaeum Hotel & Residences,"Westminster, Londres",Chambre Deluxe,Plusieurs types de lits,"8,5",678 expériences vécues,"1 nuit, 1 adulte",,€ 705
Jumeirah Lowndes Hotel,"Kensington et Chelsea, Londres",Chambre Double Supérieure,Types de lits : 1 lit double ou 2 lits simples,"8,0",401 expériences vécues,"1 nuit, 1 adulte",,€ 629
The Carlton Tower Jumeirah,"Kensington et Chelsea, Londres",Chambre Supérieure avec Accès Exclusif aux Jardins Privés Cadogan Gardens,Plusieurs types de lits,"8,9",158 expériences vécues,"1 nuit, 1 adulte",,€ 1 162
"The Park Tower Knightsbridge, a Luxury Collection Hotel, London","Westminster, Londres",Suite Exécutive 1 Chambre avec 1 Lit Queen-Size,1 très grand lit double,"7,4",1 029 expériences vécues,"1 nuit, 1 adulte",,€ 1 699
Baglioni Hotel London - The Leading Hotels of the World,"Kensington et Chelsea, Londres",Suite Junior Côté Cour,"2 lits (1 très grand lit double, 1 canapé-lit)","8,9",709 expériences vécues,"1 nuit, 1 adulte",,"€ 896€ 753
-16 %"
Sheraton Grand London Park Lane,"Westminster, Londres",Chambre Lit King-Size Deluxe,1 très grand lit double,"8,2",850 expériences vécues,"1 nuit, 1 adulte",,€ 566
Maitrise Hotel Maida Vale - London,"Brent, Londres",Chambre Simple Standard,1 lit simple,"6,7",2 207 expériences vécues,"1 nuit, 1 adulte",,€ 156
Home 2 Home,"Highgate, Londres",Chambre Double,1 lit double,"5,7",3 expériences vécues,"1 nuit, 1 adulte",,€ 62
The 23,Londres,Appartement 1 Chambre,Hébergement géré par un particulier,"5,0",2 expériences vécues,"1 nuit, 1 adulte",,€ 69
The Tophams Hotel,"Westminster, Londres",Chambre Double Supérieure,1 grand lit double,"8,2",1 962 expériences vécues,"1 nuit, 1 adulte",,€ 344
Hootananny Hostel,"Lambeth, Londres",Lit Simple dans Dortoir à 6 Lits,1 lit superposé,"7,2",1 481 expériences vécues,"1 nuit, 1 adulte",,€ 39
Camden Guest House Super king or Double Bedroom,"Camden, Londres",Chambre Double Supérieure,Hébergement géré par un particulier,"8,1",107 expériences vécues,"1 nuit, 1 adulte",,€ 209
Point A Kensington Olympia,"Kensington et Chelsea, Londres",Hébergement Double Confortable avec Fenêtre de Toit,1 lit double,"7,9",4 231 expériences vécues,"1 nuit, 1 adulte",,€ 277
Wembley Rooms,"Brent, Londres",Chambre Lit King-Size Standard,Hébergement géré par un particulier,"7,5",237 expériences vécues,"1 nuit, 1 adulte",,"€ 129€ 117
-10 %"
The Montague On The Gardens,"Camden, Londres",Chambre Simple Classique,1 lit simple,"9,0",2 773 expériences vécues,"1 nuit, 1 adulte",,€ 363
Hilton London Metropole,"Westminster, Londres",Chambre King Exécutive avec Accès au Salon,1 très grand lit double,"7,5",2 964 expériences vécues,"1 nuit, 1 adulte",,€ 427
Bermonds Locke,"Southwark, Londres",Studio Locke Accessible aux Personnes à Mobilité Réduite,1 lit double,"8,9",2 062 expériences vécues,"1 nuit, 1 adulte",,€ 278
room2 Chiswick Hometel,"Chiswick, Londres",Chambre Sleepwell - Sans fenêtre,1 très grand lit double,"9,2",1 258 expériences vécues,"1 nuit, 1 adulte",,€ 225
The Rembrandt,"Kensington et Chelsea, Londres",Chambre Lits Jumeaux Classique,2 lits simples,"8,2",2 214 expériences vécues,"1 nuit, 1 adulte",,€ 350
The Heart Of Stratford..!,"Newham, Londres",Chambre Double ou Lits Jumeaux,Plusieurs types de lits,"6,3",182 expériences vécues,"1 nuit, 1 adulte",,€ 103
Finsbury Park Suites - Arsenal Stadium London,"Islington, Londres",Chambre Double,1 lit double,"7,2",114 expériences vécues,"1 nuit, 1 adulte",,€ 161
Locke at Broken Wharf,"La City, Londres",Studio,1 grand lit double,"8,8",1 156 expériences vécues,"1 nuit, 1 adulte",,€ 331
Prince Regent Hotel Excel London,"Newham, Londres",Chambre Double Standard - Annexe du Bâtiment Située à 30 Secondes à Pied du Bâtiment Principal,1 lit double,"7,7",1 462 expériences vécues,"1 nuit, 1 adulte",,€ 229
Kingsland Locke,"Hackney, Londres",Studio Sous-Sol,1 grand lit double,"8,7",1 415 expériences vécues,"1 nuit, 1 adulte",,€ 278
Corus Hyde Park Hotel,"Westminster, Londres",Chambre Simple Standard,1 lit simple,"6,6",4 879 expériences vécues,"1 nuit, 1 adulte",,"€ 400€ 340
-15 %"
Canary Wharf Holiday Rooms,"Tower Hamlets, Londres",Chambre Double,Hébergement géré par un particulier,"4,6",60 expériences vécues,"1 nuit, 1 adulte",,€ 127
luxury apartment in central London,Londres,Villa 2 Chambres :,Hébergement géré par un particulier,,"1 nuit, 1 adulte",Taxes et frais compris,,"€ 83€ 62
-25 %"
Charming Studio in Golders Green,"Golders Green, Londres",Appartement 1 Chambre,1 lit double,"7,7",4 expériences vécues,"1 nuit, 1 adulte",,€ 133
Rainbow House,"Wandsworth, Londres",Chambre Double avec Salle de Bains Privative,Hébergement géré par un particulier,"4,0",2 expériences vécues,"1 nuit, 1 adulte",,€ 91
Comfort Inn Edgware Road,"Westminster, Londres",Chambre Triple,"2 lits (1 lit simple, 1 lit double)","7,1",1 718 expériences vécues,"1 nuit, 1 adulte",,€ 260
Victorian Woods BnB,"Newham, Londres",Chambre Familiale avec Salle de Bains Commune,Hébergement géré par un particulier,"8,6",12 expériences vécues,"1 nuit, 1 adulte",,€ 124
Chiswick Lodge Hotel,"Chiswick, Londres",Chambre Double,1 lit double,"5,5",435 expériences vécues,"1 nuit, 1 adulte",,€ 160
Sonder The Voyage,"Westminster, Londres",Chambre Simple,1 lit simple,"7,7",146 expériences vécues,"1 nuit, 1 adulte",,"€ 359€ 305
-15 %"
Heathrow Stays near Southall,Londres,Chambre Double,1 lit double,"5,9",122 expériences vécues,"1 nuit, 1 adulte",,€ 84
Housing in the center of London,Londres,Villa 2 Chambres :,Hébergement géré par un particulier,,"1 nuit, 1 adulte",Taxes et frais compris,,"€ 75€ 63
-15 %"
Dave’s Chill Zone,"Norwood, Londres",Chambre Double Deluxe avec Douche,Hébergement géré par un particulier,,"1 nuit, 1 adulte",Taxes et frais compris,,"€ 93€ 75
-20 %"
OYO London Guest House,"Acton, Londres",Chambre Lits Jumeaux Standard,2 lits simples,"7,5",537 expériences vécues,"1 nuit, 1 adulte",,€ 221
Sonder Kensington Gardens,"Kensington et Chelsea, Londres",Chambre Simple,1 lit simple,"7,9",627 expériences vécues,"1 nuit, 1 adulte",,"€ 273€ 232
-15 %"
Layrek London 1 bedroom flat,"Newham, Londres",Appartement 1 Chambre,Hébergement géré par un particulier,"5,4",66 expériences vécues,"1 nuit, 1 adulte",,€ 99
COVE Cannon Street,"La City, Londres",Grand Studio ,1 grand lit double,"9,1",1 177 expériences vécues,"1 nuit, 1 adulte",,€ 288
Upton Park - House,"Newham, Londres",Dortoir Mixte ,3 lits simples,"6,2",125 expériences vécues,"1 nuit, 1 adulte",,€ 57
Tudor Court Hotel,"Westminster, Londres",Chambre Double Supérieure,1 lit double,"7,1",2 002 expériences vécues,"1 nuit, 1 adulte",,€ 330
NOX Kensington,"Kensington et Chelsea, Londres",Studio Double à Occupation Simple,1 lit double,"7,4",2 279 expériences vécues,"1 nuit, 1 adulte",,€ 284
Forest Gate Hotel,"Newham, Londres",Chambre Double Économique avec Salle de Bains Commune,1 lit double,"4,5",464 expériences vécues,"1 nuit, 1 adulte",,€ 114
FAST STAY NOW,"Hackney, Londres",Appartement 1 Chambre,Hébergement géré par un particulier,,"1 nuit, 1 adulte",Taxes et frais compris,,€ 167
The Crown Hotel,Londres,Chambre Double Deluxe,1 lit double,"7,2",3 037 expériences vécues,"1 nuit, 1 adulte",,€ 196
Devons Unique Short Stay,"Lewisham, Londres",Chambre Simple avec Salle de Bains Commune,1 lit simple,"6,9",16 expériences vécues,"1 nuit, 1 adulte",,€ 69
The Mitre by Innkeeper's Collection,"Greenwich, Londres",Chambre Simple,1 lit simple,"8,2",1 654 expériences vécues,"1 nuit, 1 adulte",,€ 206
Bentley London,"Kensington et Chelsea, Londres",Chambre Lit King-Size Deluxe,1 grand lit double,"7,1",338 expériences vécues,"1 nuit, 1 adulte",,€ 332
Nobu Hotel London Shoreditch,"Hackney, Londres",Chambre Deluxe,1 très grand lit double,"8,5",1 083 expériences vécues,"1 nuit, 1 adulte",,€ 409
Plaza London Hotel,"Tower Hamlets, Londres",Chambre Simple,1 lit simple,"5,7",1 191 expériences vécues,"1 nuit, 1 adulte",,€ 168
Jadwin Beautiful room Share kitchen and toilet (1 people),"Southwark, Londres",Chambre Double,Hébergement géré par un particulier,"7,3",40 expériences vécues,"1 nuit, 1 adulte",,"€ 140€ 119
-15 %"
Willesden Green ROOMS,"Brent, Londres",Chambre Double Économique,Hébergement géré par un particulier,"7,8",114 expériences vécues,"1 nuit, 1 adulte",,€ 138
FB2-Fantastic Basement Studio Good for 3 Near Hyde Park,"Westminster, Londres",Studio Triple Standard,Hébergement géré par un particulier,"5,9",38 expériences vécues,"1 nuit, 1 adulte",,€ 168
Point A Hotel London Paddington,"Westminster, Londres",Chambre Double - Sans Fenêtre,1 lit double,"8,1",5 436 expériences vécues,"1 nuit, 1 adulte",,€ 267
NOX Olympia,"Kensington et Chelsea, Londres",Chambre Simple,1 lit simple,"7,1",940 expériences vécues,"1 nuit, 1 adulte",,€ 229
Point A Hotel London Kings Cross – St Pancras,"Camden, Londres",Chambre Double - Sans Fenêtre,1 lit double,"8,0",1 744 expériences vécues,"1 nuit, 1 adulte",,€ 305
Park Avenue Baker Street,"Westminster, Londres",Chambre Simple Deluxe,1 lit simple,"6,7",4 372 expériences vécues,"1 nuit, 1 adulte",,€ 300
Novotel London Wembley,"Brent, Londres",Chambre Lit Queen-Size Supérieure avec Canapé,"2 lits (1 canapé-lit, 1 grand lit double)","8,4",4 576 expériences vécues,"1 nuit, 1 adulte",,€ 234
Great Priced Private Room in Thorn 5,"Lambeth, Londres",Appartement 1 Chambre,Hébergement géré par un particulier,"5,6",33 expériences vécues,"1 nuit, 1 adulte",,€ 116
Boogaard's Guest House,"Southwark, Londres",Chambre Double à 2 Niveaux avec Douche,"2 lits (1 lit double, 1 canapé-lit)","6,1",27 expériences vécues,"1 nuit, 1 adulte",,"€ 150€ 120
-20 %"
Novotel London Blackfriars,"Southwark, Londres",Chambre Supérieure avec 1 Lit Queen-Size + 1 Canapé-lit,"2 lits (1 canapé-lit, 1 grand lit double)","8,2",3 210 expériences vécues,"1 nuit, 1 adulte",,€ 344
Manor House London,Londres,Chambre Double Supérieure,1 très grand lit double,"6,5",886 expériences vécues,"1 nuit, 1 adulte",,€ 149
Guest House London,Londres,Chambre Double avec Salle de Bains Privative,Hébergement géré par un particulier,"6,5",137 expériences vécues,"1 nuit, 1 adulte",,€ 108
Circlelet Luxury Private Suite 2,"Westminster, Londres",Appartement 1 Chambre,"2 lits (1 lit double, 1 canapé-lit)","9,0",1 expérience vécue,"1 nuit, 1 adulte",,€ 433
The Prime London Hotel,"Kensington et Chelsea, Londres",Chambre Double Supérieure,1 lit double,"8,2",893 expériences vécues,"1 nuit, 1 adulte",,€ 331
Verv Islington,"Islington, Londres",Studio avec Canapé-Lit,1 lit double,"6,9",258 expériences vécues,"1 nuit, 1 adulte",,€ 233
London - Wembley International Hotel,"Brent, Londres",Chambre Simple,1 lit double,"6,7",4 951 expériences vécues,"1 nuit, 1 adulte",,€ 269
272&294 Franciscan Road Rooms&Studios by DC London Rooms,"Wandsworth, Londres",Chambre Double avec Salle de Bains Commune,1 lit double,"5,9",499 expériences vécues,"1 nuit, 1 adulte",,"€ 160€ 140
-13 %"
prospect hill,"Walthamstow, Londres",Chambre Double,Hébergement géré par un particulier,"5,4",57 expériences vécues,"1 nuit, 1 adulte",,€ 69
The Clerk & Well Pub and Rooms,"Camden, Londres",Chambre Double Supérieure,1 grand lit double,"8,6",423 expériences vécues,"1 nuit, 1 adulte",,€ 392
RAYAN'S LODGE STRATFORD,"Newham, Londres",Chambre Lit King-Size,1 très grand lit double,"7,3",9 expériences vécues,"1 nuit, 1 adulte",,€ 117
Limehouse Library Hotel,"Tower Hamlets, Londres",Chambre Simple Supérieure,1 lit simple,"8,8",678 expériences vécues,"1 nuit, 1 adulte",,€ 310
The Pride of Paddington,"Westminster, Londres",Chambre Simple,1 lit simple,"8,2",265 expériences vécues,"1 nuit, 1 adulte",,€ 286
'TheFive' Camden Town,"Camden, Londres",Chambre Double avec Lit d'Appoint,Hébergement géré par un particulier,,"1 nuit, 1 adulte",Taxes et frais compris,,€ 202
Cosy house in Newham,"Newham, Londres",Chambre Double,Hébergement géré par un particulier,"8,2",9 expériences vécues,"1 nuit, 1 adulte",,€ 86
Double room with balcony near park,"Southwark, Londres",Chambre Double avec Balcon,Hébergement géré par un particulier,"4,5",4 expériences vécues,"1 nuit, 1 adulte",,€ 75
Caledonian Studio Flats,"Islington, Londres",Suite 1 Chambre,Hébergement géré par un particulier,"6,9",296 expériences vécues,"1 nuit, 1 adulte",,€ 212
London Queen Park Apartments,"Brent, Londres",Studio,1 lit double,"6,5",618 expériences vécues,"1 nuit, 1 adulte",,€ 179
The Z Hotel City,"La City, Londres",Chambre Double sans Fenêtre,1 lit double,"7,8",7 708 expériences vécues,"1 nuit, 1 adulte",,€ 300
Highbury & Islington Hub,"Islington, Londres",Studio,"2 lits (1 lit double, 1 canapé-lit)","6,9",185 expériences vécues,"1 nuit, 1 adulte",,€ 262
Hellenic Hotel by Saba,"Hammersmith and Fulham, Londres",Chambre Double avec Salle de Bains Privative,1 lit double,"6,8",1 319 expériences vécues,"1 nuit, 1 adulte",,€ 270
ibis London Wembley,"Brent, Londres",Chambre Double,1 lit double,"7,8",6 576 expériences vécues,"1 nuit, 1 adulte",,€ 175
Park Villa Boutique Hostel,"Tower Hamlets, Londres",Lit dans Dortoir pour Femmes de 6 Lits,1 lit superposé,"8,0",567 expériences vécues,"1 nuit, 1 adulte",,€ 77
IR Hackney Deluxe,Londres,Chambre Double,1 lit double,,"1 nuit, 1 adulte",Taxes et frais compris,,€ 207
247London Studio Flats,"Brent, Londres",Studio Double,1 lit superposé,"4,7",9 expériences vécues,"1 nuit, 1 adulte",,€ 150
"OYO The Arch, Wembly Stadium","Brent, Londres",Chambre Simple Standard,1 lit simple,"7,4",1 113 expériences vécues,"1 nuit, 1 adulte",,€ 202
Kensal Green Backpackers,"Kensington et Chelsea, Londres",Lit dans Dortoir pour Femmes de 4 Lits,1 lit superposé,"5,0",1 392 expériences vécues,"1 nuit, 1 adulte",,€ 27
Point A London Liverpool Street,"Tower Hamlets, Londres",Chambre Double sans Fenêtre,1 lit double,"7,8",7 581 expériences vécues,"1 nuit, 1 adulte",,€ 296
Grays inn apartments,"Camden, Londres",Appartement 1 Chambre,Hébergement géré par un particulier,,"1 nuit, 1 adulte",Taxes et frais compris,,€ 226
Novotel London Waterloo,"Lambeth, Londres",Chambre Lit Queen-Size Supérieure avec Canapé,"2 lits (1 canapé-lit, 1 grand lit double)","7,9",2 779 expériences vécues,"1 nuit, 1 adulte",,€ 401
"Holiday Inn Express Royal Docks, an IHG Hotel","Newham, Londres",Chambre Double avec Canapé-Lit,1 lit double,"7,7",3 981 expériences vécues,"1 nuit, 1 adulte",,"€ 305€ 214
-30 %"
Sonder Chelsea Green,"Kensington et Chelsea, Londres",Chambre Supérieure Lit Queen-Size,1 grand lit double,"7,7",2 199 expériences vécues,"1 nuit, 1 adulte",,"€ 400€ 340
-15 %"
CannyCity,"Newham, Londres",Appartement 1 Chambre,1 lit double,,"1 nuit, 1 adulte",Taxes et frais compris,,"€ 274€ 240
-12 %"
London Luxury Apartment with Private Jacuzzi Hot tub & Sauna,"Tower Hamlets, Londres",Appartement Supérieur avec Sauna,Hébergement géré par un particulier,"6,3",3 expériences vécues,"1 nuit, 1 adulte",,€ 311
Sonder Camden Road,"Camden, Londres",Chambre Simple,1 lit simple,"7,9",1 348 expériences vécues,"1 nuit, 1 adulte",,€ 265
Cosy Ealing Homestay,"Ealing, Londres",Chambre Simple avec Salle de Bains Commune,Hébergement géré par un particulier,"8,5",104 expériences vécues,"1 nuit, 1 adulte",,€ 86
Glendale Hyde Park Hotel,"Westminster, Londres",Chambre Double,1 lit double,"6,3",988 expériences vécues,"1 nuit, 1 adulte",,€ 405
Sonder St Johns Garden,"Islington, Londres",Chambre Double,1 lit double,"6,7",243 expériences vécues,"1 nuit, 1 adulte",,€ 297
Deptford Apartments,"Lewisham, Londres",Appartement 1 Chambre,1 lit double,"7,7",79 expériences vécues,"1 nuit, 1 adulte",,€ 173
Pestana Chelsea Bridge Hotel,"Wandsworth, Londres",Chambre Lits Jumeaux Deluxe,2 lits simples,"8,2",3 911 expériences vécues,"1 nuit, 1 adulte",,€ 294
Hampton by Hilton London Park Royal,"Ealing, Londres",Chambre Lit Super King-Size,1 très grand lit double,"8,2",3 430 expériences vécues,"1 nuit, 1 adulte",,€ 324
Three Harrington Residences,"Kensington et Chelsea, Londres",Flat 5 - Large Studio Apartment,1 grand lit double,"8,3",12 expériences vécues,"1 nuit, 1 adulte",,€ 356
Point A Hotel London Westminster,"Lambeth, Londres",Chambre Double sans Fenêtre,1 lit double,"7,3",3 310 expériences vécues,"1 nuit, 1 adulte",,€ 300
Spacious Apartments in Westminster,"Westminster, Londres",Appartement,1 lit double,"7,3",103 expériences vécues,"1 nuit, 1 adulte",,€ 273
"Charlotte Street Hotel, Firmdale Hotels","Westminster, Londres",Chambre Supérieure,1 grand lit double,"9,2",163 expériences vécues,"1 nuit, 1 adulte",,€ 692
Upton Park Bedrooms 25 min to Central London,"Newham, Londres",Chambre Double avec Salle de Bains Commune,1 lit double,"6,7",193 expériences vécues,"1 nuit, 1 adulte",,€ 86
30 willesden lane,"Brent, Londres",Chambre Simple,1 lit simple,"4,9",53 expériences vécues,"1 nuit, 1 adulte",,€ 93
