Nom_Hotel,Adresse,Nom_Suite,Services,Note,Nbr_Experiences,Periode,Date,Prix
Dao by Dorsett West London,"Hammersmith and Fulham, Londres",Studio Standard,1 très grand lit double,"8,4",995 expériences vécues,"1 nuit, 1 adulte",,"€ 402€ 281
-30 %"
Melia White House Hotel,"West End, Londres",Chambre Double Deluxe,1 très grand lit double,"7,8",2 172 expériences vécues,"1 nuit, 1 adulte",,€ 312
US Embassy Riverside Apartment,"Wandsworth, Londres",Appartement 2 Chambres,"4 lits (2 lits simples, 1 lit double, 1 canapé-lit)",,"1 nuit, 1 adulte",Taxes et frais compris,,€ 3 684
Jubilee Hotel Victoria,"Westminster, Londres",Chambre Simple avec Toilettes et Douche Communes,1 lit simple,"8,0",485 expériences vécues,"1 nuit, 1 adulte",,€ 167
The Chilworth London Paddington,"Westminster, Londres",Chambre Simple Deluxe,1 lit simple,"7,6",7 806 expériences vécues,"1 nuit, 1 adulte",,€ 211
Olympic Park Apartments,"Newham, Londres",Appartement 1 Chambre,"2 lits (1 lit double, 1 canapé-lit)",,"1 nuit, 1 adulte",Taxes et frais compris,,€ 249
"Club Quarters Hotel London City, London","La City, Londres",Chambre Standard Lit Queen-Size,1 grand lit double,"7,3",4 011 expériences vécues,"1 nuit, 1 adulte",,€ 241
Strand Palace Hotel,"Westminster, Londres",Hébergement Simple Confort,1 lit simple,"8,1",12 434 expériences vécues,"1 nuit, 1 adulte",,€ 219
The Academy - Small Luxury Hotels of the World,"Camden, Londres",Chambre Simple Maison de Ville,1 lit simple,"8,1",2 164 expériences vécues,"1 nuit, 1 adulte",,€ 238
The California,"Camden, Londres",Petite Chambre Simple,1 lit simple,"7,7",2 979 expériences vécues,"1 nuit, 1 adulte",,€ 248
Bloomsbury Palace Hotel,"Camden, Londres",Chambre Simple,1 lit simple,"6,5",3 055 expériences vécues,"1 nuit, 1 adulte",,€ 163
Regency Hotel Westend,"Westminster, Londres",Chambre Simple,1 lit simple,"7,2",625 expériences vécues,"1 nuit, 1 adulte",,€ 218
Hilton London Euston,"Camden, Londres",Chambre Simple,1 lit simple,"7,2",1 986 expériences vécues,"1 nuit, 1 adulte",,€ 266
Balmoral House Hotel,"Westminster, Londres",Chambre Simple avec Douche ,1 lit simple,"7,6",1 137 expériences vécues,"1 nuit, 1 adulte",,€ 218
Regency Hotel Parkside,"Westminster, Londres",Chambre Simple,1 lit simple,"8,0",1 338 expériences vécues,"1 nuit, 1 adulte",,€ 229
DoubleTree by Hilton London – West End,"Camden, Londres",Chambre Simple,1 lit simple,"7,1",2 748 expériences vécues,"1 nuit, 1 adulte",,€ 255
Ambassadors Bloomsbury,"Camden, Londres",Chambre Double,1 lit double,"6,9",1 775 expériences vécues,"1 nuit, 1 adulte",,"€ 264€ 238
-10 %"
Mercure London Bloomsbury Hotel,"Camden, Londres",Chambre Simple Standard,1 lit simple,"7,3",1 343 expériences vécues,"1 nuit, 1 adulte",,€ 270
DoubleTree by Hilton Hotel London - Tower of London,"La City, Londres",Chambre Lits Jumeaux,2 lits simples,"7,6",10 934 expériences vécues,"1 nuit, 1 adulte",,€ 298
Come stay x,"Highgate, Londres",Chambre Double,Hébergement géré par un particulier,,"1 nuit, 1 adulte",Taxes et frais compris,,€ 62
Centrel to london single room quiet home with host,"Brent, Londres",Chambre Simple,Hébergement géré par un particulier,,144 commentaires externes,"1 nuit, 1 adulte",,€ 67
Clink261 Hostel,"Camden, Londres",Capsule dans Dortoir Mixte de 14 Lits,1 lit superposé,"7,2",5 765 expériences vécues,"1 nuit, 1 adulte",,€ 83
"Crowne Plaza London Kings Cross, an IHG Hotel","Islington, Londres",Chambre Standard,1 lit double,"7,6",3 536 expériences vécues,"1 nuit, 1 adulte",,€ 224
"Holiday Inn London Bloomsbury, an IHG Hotel","Camden, Londres",Chambre Double Standard,1 lit double,"7,9",2 861 expériences vécues,"1 nuit, 1 adulte",,€ 248
The Lodge Hotel - Putney,"Wandsworth, Londres",Chambre Simple Standard,1 lit simple,"8,5",2 309 expériences vécues,"1 nuit, 1 adulte",,€ 267
Gresham Hotel Bloomsbury,"Camden, Londres",Chambre Simple avec Salle de Bains Commune,1 lit simple,"4,4",2 099 expériences vécues,"1 nuit, 1 adulte",,€ 119
"Inhabit, Southwick Street","Westminster, Londres",Chambre Simple Deluxe,1 lit simple,"8,0",5 296 expériences vécues,"1 nuit, 1 adulte",,€ 274
Park Grand London Hyde Park,"Westminster, Londres",Chambre Simple Deluxe,1 lit simple,"6,9",5 328 expériences vécues,"1 nuit, 1 adulte",,€ 220
Hilton London Kensington Hotel,"Kensington et Chelsea, Londres",Chambre Double Hilton,1 lit double,"6,9",3 539 expériences vécues,"1 nuit, 1 adulte",,€ 208
Park Avenue Bayswater Inn Hyde Park,"Westminster, Londres",Chambre Simple,1 lit simple,"7,3",2 990 expériences vécues,"1 nuit, 1 adulte",,"€ 373€ 299
-20 %"
Palace Court Hotel,"Kensington et Chelsea, Londres",Chambre Simple,1 lit simple,"5,4",1 215 expériences vécues,"1 nuit, 1 adulte",,€ 103
House o' Books,"Southwark, Londres",Chambre Simple avec Salle de Bains Commune,Hébergement géré par un particulier,,"1 nuit, 1 adulte",Taxes et frais compris,,€ 67
Zedwell Greenwich,"Greenwich, Londres",Chambre Double,1 lit double,"7,1",108 expériences vécues,"1 nuit, 1 adulte",,€ 207
"Radisson Blu Edwardian New Providence Wharf Hotel, London","Tower Hamlets, Londres",Chambre Lit King-Size ou Lits Jumeaux Supérieure,Types de lits : 1 lit double ou 2 lits simples,"8,8",6 032 expériences vécues,"1 nuit, 1 adulte",,€ 265
Leonardo Royal London St Paul’s,"La City, Londres",Chambre Lit King-Size Supérieure,1 très grand lit double,"8,5",8 067 expériences vécues,"1 nuit, 1 adulte",,€ 435
Washington Mayfair Hotel,"Westminster, Londres",Chambre Double Classique,1 lit double,"6,9",854 expériences vécues,"1 nuit, 1 adulte",,€ 293
Millennium & Copthorne Hotels at Chelsea Football Club,"Hammersmith and Fulham, Londres",Chambre Double Standard,1 lit double,"7,8",4 760 expériences vécues,"1 nuit, 1 adulte",,€ 227
"Radisson Blu Edwardian Bloomsbury Street Hotel, London","Camden, Londres",Chambre Double Standard,1 lit double,"8,4",4 091 expériences vécues,"1 nuit, 1 adulte",,€ 518
Canopy by Hilton London City,"La City, Londres",Chambre Lit King-Size,1 très grand lit double,"8,7",1 614 expériences vécues,"1 nuit, 1 adulte",,€ 325
Park Grand Paddington Court,"Westminster, Londres",Chambre Simple Deluxe,1 lit simple,"6,9",5 649 expériences vécues,"1 nuit, 1 adulte",,€ 208
The Brent Hotel - London - Wembley,"Brent, Londres",Chambre Simple,1 lit simple,"8,0",210 expériences vécues,"1 nuit, 1 adulte",,€ 144
KingswayPark Hotel at Park Avenue,"Westminster, Londres",Chambre Simple Standard,1 lit simple,"7,1",652 expériences vécues,"1 nuit, 1 adulte",,€ 203
Andaz London Liverpool Street - a Concept by Hyatt,"La City, Londres",Chambre Lit Queen-Size ,1 grand lit double,"8,7",799 expériences vécues,"1 nuit, 1 adulte",,€ 293
Studios2Let,"Camden, Londres",Studio Standard avec Balcon,1 lit double,"7,6",8 806 expériences vécues,"1 nuit, 1 adulte",,€ 285
"Threadneedles, Autograph Collection","La City, Londres",Chambre de Luxe avec 1 Lit Queen-Size,1 grand lit double,"8,1",208 expériences vécues,"1 nuit, 1 adulte",,€ 322
Swinton Hotel,"Camden, Londres",Chambre Simple,1 lit simple,"7,5",3 565 expériences vécues,"1 nuit, 1 adulte",,€ 196
Bedford Corner Hotel,"Camden, Londres",Chambre Simple,1 lit simple,"7,7",2 892 expériences vécues,"1 nuit, 1 adulte",,€ 264
Novotel London West,"Hammersmith and Fulham, Londres",Chambre Supérieure Lit Queen-Size,1 grand lit double,"7,3",4 519 expériences vécues,"1 nuit, 1 adulte",,€ 237
Royal Park Hotel,"Westminster, Londres",Chambre Lits Jumeaux Standard,2 lits simples,"7,0",2 760 expériences vécues,"1 nuit, 1 adulte",,€ 218
Brick lane stay,"Tower Hamlets, Londres",Chambre Simple Économique,1 lit simple,"4,4",763 expériences vécues,"1 nuit, 1 adulte",,€ 68
The Cavendish London,"Westminster, Londres",Chambre Double Classique,1 lit double,"8,1",2 586 expériences vécues,"1 nuit, 1 adulte",,€ 365
citizenM London Victoria Station,"Westminster, Londres",Chambre Lit King-Size,1 très grand lit double,"8,9",3 063 expériences vécues,"1 nuit, 1 adulte",,€ 333
Comfotel BLU,"Hammersmith and Fulham, Londres",Chambre Simple,1 lit simple,"6,1",903 expériences vécues,"1 nuit, 1 adulte",,"€ 150€ 120
-20 %"
Park Plaza London Riverbank,"Lambeth, Londres",Chambre Double Supérieure,1 lit double,"8,1",11 118 expériences vécues,"1 nuit, 1 adulte",,€ 279
The Montcalm At Brewery London City,"La City, Londres",Chambre Double Deluxe,1 lit double,"6,9",4 051 expériences vécues,"1 nuit, 1 adulte",,€ 352
Pullman London St Pancras,"Camden, Londres",Chambre Lit King-Size Classique,1 très grand lit double,"8,4",3 676 expériences vécues,"1 nuit, 1 adulte",,€ 299
DoubleTree by Hilton London Angel Kings Cross,"Islington, Londres",Chambre Double,1 lit double,"7,9",4 882 expériences vécues,"1 nuit, 1 adulte",,€ 240
"Hart Shoreditch Hotel London, Curio Collection by Hilton","Hackney, Londres",Chambre Lit Queen-Size,1 grand lit double,"9,0",2 068 expériences vécues,"1 nuit, 1 adulte",,€ 257
Dawson House,"Camden, Londres",Chambre Simple avec Salle de Bains Privative à l’Extérieur de la Chambre,1 lit simple,"8,3",699 expériences vécues,"1 nuit, 1 adulte",,€ 119
Tavistock Hotel,"Camden, Londres",Chambre Double - Vue sur Jardin,1 lit double,"7,5",2 709 expériences vécues,"1 nuit, 1 adulte",,€ 265
Bob W Hyde Park,"Westminster, Londres",Chambre Simple Supérieure,1 lit simple,"8,3",338 expériences vécues,"1 nuit, 1 adulte",,"€ 347€ 295
-15 %"
Hotel Oliver,"Kensington et Chelsea, Londres",Chambre Simple,1 lit simple,"6,5",1 907 expériences vécues,"1 nuit, 1 adulte",,€ 161
Wns Hotel Canary Wharf,"Tower Hamlets, Londres",Chambre Double Deluxe,1 lit double,"5,6",512 expériences vécues,"1 nuit, 1 adulte",,€ 103
Citadines Holborn - Covent Garden London,"Camden, Londres",Studio,Types de lits : 1 lit double ou 2 lits simples,"7,7",1 853 expériences vécues,"1 nuit, 1 adulte",,€ 317
Thanet Hotel Annex,"Camden, Londres",Chambre Simple Basique,1 lit simple,"4,2",760 expériences vécues,"1 nuit, 1 adulte",,€ 108
Clayton Hotel London Wall,"La City, Londres",Chambre King City,1 grand lit double,"8,9",807 expériences vécues,"1 nuit, 1 adulte",,€ 341
"Radisson Blu Edwardian Grafton Hotel, London","Camden, Londres",Chambre Simple Supérieure,1 lit simple,"7,9",6 008 expériences vécues,"1 nuit, 1 adulte",,€ 258
Ivy House Hotel,"Westminster, Londres",Chambre Simple Standard avec Salle de Bains Commune,1 lit simple,"6,2",229 expériences vécues,"1 nuit, 1 adulte",,€ 119
The Goodenough Hotel London,"Camden, Londres",Chambre Simple - Vue sur Cour,1 lit simple,"8,0",2 048 expériences vécues,"1 nuit, 1 adulte",,€ 279
"Club Quarters Hotel St Paul's, London","La City, Londres",Chambre Standard Accessible aux Personnes à Mobilité Réduite,1 grand lit double,"7,6",4 432 expériences vécues,"1 nuit, 1 adulte",,€ 246
The Barbican Rooms,"Islington, Londres",Chambre Simple Deluxe,1 lit simple,"7,5",3 790 expériences vécues,"1 nuit, 1 adulte",,€ 331
Sidney Hotel London-Victoria,"Westminster, Londres",Chambre Simple,1 lit simple,"7,8",10 687 expériences vécues,"1 nuit, 1 adulte",,€ 225
"The Rathbone Hotel, Fitzrovia","Westminster, Londres",Chambre Simple,1 lit simple,"8,5",1 215 expériences vécues,"1 nuit, 1 adulte",,€ 310
DoubleTree by Hilton London – Docklands Riverside,"Southwark, Londres",Chambre Double,1 lit double,"7,9",6 064 expériences vécues,"1 nuit, 1 adulte",,€ 220
"Private Rooms in London,","Lambeth, Londres",Chambre Simple,Hébergement géré par un particulier,"7,9",132 expériences vécues,"1 nuit, 1 adulte",,€ 51
"The Royal Horseguards Hotel, London","Westminster, Londres",Chambre Simple Standard,1 lit simple,"8,1",2 990 expériences vécues,"1 nuit, 1 adulte",,€ 294
Palmers Lodge Swiss Cottage,"Camden, Londres",Lit dans Dortoir Mixte de 12 Lits,1 lit superposé,"8,2",1 961 expériences vécues,"1 nuit, 1 adulte",,"€ 104€ 81
-22 %"
"The Hoxton, Shoreditch","Hackney, Londres",Hébergement Double Confortable,1 lit double,"8,4",1 907 expériences vécues,"1 nuit, 1 adulte",,€ 345
The Judd Hotel,"Camden, Londres",Chambre Simple,1 lit simple,"7,4",3 081 expériences vécues,"1 nuit, 1 adulte",,€ 278
"Great Scotland Yard Hotel, part of Hyatt","Westminster, Londres",Chambre Lit King-Size,1 très grand lit double,"8,7",807 expériences vécues,"1 nuit, 1 adulte",,€ 416
Elmwood Hotel,"Camden, Londres",Hébergement Simple,1 lit simple,"5,9",1 871 expériences vécues,"1 nuit, 1 adulte",,€ 164
DoubleTree by Hilton London Victoria,"Westminster, Londres",Chambre Double,1 lit double,"7,7",3 029 expériences vécues,"1 nuit, 1 adulte",,€ 319
Apex Temple Court Hotel,"La City, Londres",Suite Junior avec Accès au Salon Club ,1 très grand lit double,"8,9",3 235 expériences vécues,"1 nuit, 1 adulte",,"€ 471€ 377
-20 %"
Central Station,"Islington, Londres",Chambre Simple avec Salle de Bains Commune,1 lit simple,"6,8",616 expériences vécues,"1 nuit, 1 adulte",,€ 144
The Mayfair Townhouse - an Iconic Luxury Hotel,"Westminster, Londres",Chambre Simple,1 lit simple,"8,6",1 306 expériences vécues,"1 nuit, 1 adulte",,€ 344
"Radisson Blu Edwardian Kenilworth Hotel, London","Camden, Londres",Chambre Simple Supérieure,1 lit simple,"7,9",4 547 expériences vécues,"1 nuit, 1 adulte",,€ 289
Hotel Saint London,"La City, Londres",Chambre Premier,1 grand lit double,"8,4",2 163 expériences vécues,"1 nuit, 1 adulte",,€ 288
Zedwell Underground Tottenham Court Rd,"Camden, Londres",Hébergement Cocon 1 - Accessible aux Personnes à Mobilité Réduite,1 lit simple,"6,5",1 376 expériences vécues,"1 nuit, 1 adulte",,€ 252
Seraphine Hammersmith Hotel,"Hammersmith and Fulham, Londres",Chambre Double Standard,1 lit double,"7,8",1 598 expériences vécues,"1 nuit, 1 adulte",,€ 239
Single studio shared bathroom/toilet Near Paddington,"Westminster, Londres",Studio,1 lit simple,"4,8",15 expériences vécues,"1 nuit, 1 adulte",,€ 104
City Rooms,"Tower Hamlets, Londres",Chambre Double Économique,Hébergement géré par un particulier,"6,9",951 expériences vécues,"1 nuit, 1 adulte",,€ 124
London House Hotel,"Westminster, Londres",Chambre Simple,1 lit simple,"7,6",2 019 expériences vécues,"1 nuit, 1 adulte",,€ 258
ibis London City - Shoreditch,"Tower Hamlets, Londres",Chambre Double SweetRoom,1 lit double,"7,9",6 101 expériences vécues,"1 nuit, 1 adulte",,€ 250
Citadines Barbican London,"Islington, Londres",Chambre Double ou Lits Jumeaux Classique,Types de lits : 1 lit double ou 2 lits simples,"8,2",1 989 expériences vécues,"1 nuit, 1 adulte",,€ 279
Chelsea Cloisters,"Kensington et Chelsea, Londres",Studio,1 lit double,"7,0",5 842 expériences vécues,"1 nuit, 1 adulte",,€ 231
The Waldorf Hilton,"Westminster, Londres",Chambre Queen Hilton de Luxe ,1 lit double,"7,8",2 081 expériences vécues,"1 nuit, 1 adulte",,€ 429
Nice Battersea Flat,"Wandsworth, Londres",Chambre Double,Hébergement géré par un particulier,,"1 nuit, 1 adulte",Taxes et frais compris,,€ 75
Blandford Hotel,"Westminster, Londres",Chambre Simple,1 lit simple,"7,5",1 878 expériences vécues,"1 nuit, 1 adulte",,€ 273
Citadines Trafalgar Square,"Westminster, Londres",Studio,Types de lits : 1 lit double ou 2 lits simples,"8,0",3 989 expériences vécues,"1 nuit, 1 adulte",,€ 304
Best Western Plus Vauxhall Hotel,"Lambeth, Londres",Chambre Double Standard - Sans Fenêtre,1 lit double,"7,2",1 180 expériences vécues,"1 nuit, 1 adulte",,€ 249
Langham Court Hotel,"Westminster, Londres",Chambre Simple Exécutive,1 lit double,"7,1",2 785 expériences vécues,"1 nuit, 1 adulte",,"€ 388€ 349
-10 %"
TRIBE London Canary Wharf,"Tower Hamlets, Londres",Hébergement Atrium TRIBE Essentiel,,"8,4",2 346 expériences vécues,"1 nuit, 1 adulte",,€ 315
"art'otel London Battersea Power Station, Powered by Radisson Hotels","Wandsworth, Londres",Chambre Lit King-Size Art,1 grand lit double,"8,8",1 318 expériences vécues,"1 nuit, 1 adulte",,€ 435
"Radisson Blu Edwardian Vanderbilt Hotel, London","Kensington et Chelsea, Londres",Chambre Premium ,1 très grand lit double,"7,7",2 795 expériences vécues,"1 nuit, 1 adulte",,€ 414
Sapphire Hotel London,"Hammersmith and Fulham, Londres",Chambre Simple - Salle de Bains Privative,1 lit simple,"5,9",1 681 expériences vécues,"1 nuit, 1 adulte",,€ 103
"Shangri-La The Shard, London","Southwark, Londres",Hébergement Supérieur Shard avec Lit King-Size,1 très grand lit double,"9,0",3 097 expériences vécues,"1 nuit, 1 adulte",,€ 980
"Montcalm East, Autograph Collection","Hackney, Londres",Chambre Lit Queen-Size Anything But Standard - Vue sur Ville,1 grand lit double,"8,6",3 780 expériences vécues,"1 nuit, 1 adulte",,€ 269
The Angerstein Hotel,"Greenwich, Londres",Chambre Simple avec Salle de Bains Commune,1 lit simple,"7,5",1 419 expériences vécues,"1 nuit, 1 adulte",,€ 73
Kabannas London St Pancras,"Camden, Londres",Lit dans Dortoir Mixte de 6 Lits,1 lit simple,"8,1",3 363 expériences vécues,"1 nuit, 1 adulte",,€ 57
ibis London Shepherds Bush - Hammersmith,"Hammersmith and Fulham, Londres",Chambre Double,1 lit double,"7,9",2 094 expériences vécues,"1 nuit, 1 adulte",,€ 201
"The Clermont London, Charing Cross","Westminster, Londres",Chambre Double Classique,1 grand lit double,"8,7",4 010 expériences vécues,"1 nuit, 1 adulte",,€ 371
Motel One London-Tower Hill,"La City, Londres",Chambre Standard Lit Queen-Size,1 grand lit double,"8,5",5 236 expériences vécues,"1 nuit, 1 adulte",,€ 276
Camden Enterprise Hotel,"Camden, Londres",Hébergement Double Deluxe - Rue Ferdinand,1 grand lit double,"8,6",2 710 expériences vécues,"1 nuit, 1 adulte",,"€ 281€ 253
-10 %"
YOTEL London City,"Islington, Londres",Chambre Double,1 grand lit double,"8,0",5 578 expériences vécues,"1 nuit, 1 adulte",,€ 278
London Marriott Hotel Kensington,"Kensington et Chelsea, Londres",Chambre Lit Queen-Size Deluxe,1 grand lit double,"8,2",718 expériences vécues,"1 nuit, 1 adulte",,€ 423
Hilton London Bankside,"Southwark, Londres",Chambre Lit King-Size,1 très grand lit double,"8,9",2 697 expériences vécues,"1 nuit, 1 adulte",,€ 398
Hotel 55,"Ealing, Londres",Suite,1 lit double,"8,0",2 921 expériences vécues,"1 nuit, 1 adulte",,€ 218
King hotel,"Kensington et Chelsea, Londres",Chambre Simple,1 lit simple,"3,6",5 expériences vécues,"1 nuit, 1 adulte",,€ 95
The Z Hotel Soho,"Westminster, Londres",Chambre Simple,1 lit simple,"7,5",6 517 expériences vécues,"1 nuit, 1 adulte",,€ 346
Tulse Hill Luxury Cosy Rooms,"Lambeth, Londres",Chambre Double avec Salle de Bains Privative,1 lit double,"8,7",358 expériences vécues,"1 nuit, 1 adulte",,€ 178
YHA London St Paul's,"La City, Londres",Lits Superposés dans Dortoir Masculin ,1 lit superposé,"7,7",708 expériences vécues,"1 nuit, 1 adulte",,€ 58
DoubleTree by Hilton London - Hyde Park,"Kensington et Chelsea, Londres",Chambre Simple,1 lit simple,"7,6",2 317 expériences vécues,"1 nuit, 1 adulte",,€ 309
Hilton London Wembley,"Brent, Londres",Chambre Lit King-Size,1 grand lit double,"8,5",5 947 expériences vécues,"1 nuit, 1 adulte",,€ 255
YHA London Thameside,"Southwark, Londres",Lits Superposés dans Dortoir Masculin ,1 lit superposé,"8,1",192 expériences vécues,"1 nuit, 1 adulte",,€ 40
Wardonia Hotel,"Camden, Londres",Chambre Lits Jumeaux,2 lits simples,"6,8",2 280 expériences vécues,"1 nuit, 1 adulte",,€ 186
YHA London Earl's Court,"Kensington et Chelsea, Londres",Lit Superposé en Dortoir Masculin avec Salle de Bains Commune,1 lit simple,"8,4",2 190 expériences vécues,"1 nuit, 1 adulte",,€ 58
W London,"Westminster, Londres",Chambre Lit King-Size Wonderful - Étage Inférieur,1 très grand lit double,"8,6",765 expériences vécues,"1 nuit, 1 adulte",,€ 530
Admiral Hotel at Park Avenue,"Westminster, Londres",Chambre Simple,1 lit simple,"6,9",1 496 expériences vécues,"1 nuit, 1 adulte",,€ 203
Park Grand London Lancaster Gate,"Westminster, Londres",Chambre Simple Deluxe,1 lit simple,"7,4",1 880 expériences vécues,"1 nuit, 1 adulte",,€ 311
Apex City Of London Hotel,"La City, Londres",Chambre Lit King-Size ou Lits Jumeaux City,Plusieurs types de lits,"8,8",2 022 expériences vécues,"1 nuit, 1 adulte",,"€ 391€ 313
-20 %"
Hilton London Olympia,"Kensington et Chelsea, Londres",Chambre Double Premium,1 lit double,"7,0",2 457 expériences vécues,"1 nuit, 1 adulte",,€ 288
Affordable Private Rooms in Wembley,"Brent, Londres",Chambre Double - Vue sur Jardin,Hébergement géré par un particulier,"7,7",166 expériences vécues,"1 nuit, 1 adulte",,€ 59
Arosfa Hotel London by Compass Hospitality,"Camden, Londres",Chambre Simple,1 lit simple,"7,9",1 190 expériences vécues,"1 nuit, 1 adulte",,€ 236
"Holiday Inn London - Regent's Park, an IHG Hotel","Westminster, Londres",Chambre Double Standard - Accessible aux Personnes à Mobilité Réduite,1 lit double,"7,9",4 584 expériences vécues,"1 nuit, 1 adulte",,"€ 379€ 265
-30 %"
Pasha Hotel - 3* Boutique Hotel,"Southwark, Londres",Chambre Simple Économique,1 lit simple,"4,2",1 479 expériences vécues,"1 nuit, 1 adulte",,€ 92
F301-Awesome 3rd Flr Studio Fits 1 Near Hyde Park,"Westminster, Londres",Studio,1 lit simple,"6,2",42 expériences vécues,"1 nuit, 1 adulte",,€ 104
Private room in Camden,"Camden, Londres",Chambre Double,Hébergement géré par un particulier,,14 commentaires externes,"1 nuit, 1 adulte",,€ 98
The Londoner,"Westminster, Londres",Chambre Lit King-Size Deluxe,1 très grand lit double,"9,0",3 844 expériences vécues,"1 nuit, 1 adulte",,€ 804
"Great Northern Hotel, A Tribute Portfolio Hotel, London","Camden, Londres",Chambre Double Couchette,1 lit double,"8,2",552 expériences vécues,"1 nuit, 1 adulte",,€ 371
The Z Hotel Victoria,"Westminster, Londres",Chambre Double sans Fenêtre,1 lit double,"7,8",7 797 expériences vécues,"1 nuit, 1 adulte",,€ 300
Garden Court Hotel,"Westminster, Londres",Chambre Simple avec Salle de Bains Extérieure Privative,1 lit simple,"7,5",2 858 expériences vécues,"1 nuit, 1 adulte",,"€ 344€ 276
-20 %"
DoubleTree by Hilton London Ealing,"Ealing, Londres",Chambre Lit Queen-Size ,1 lit double,"7,7",1 836 expériences vécues,"1 nuit, 1 adulte",,€ 209
St. Pancras Renaissance Hotel London,"Camden, Londres",Chambre Deluxe 1 Lit Queen-Size ou 2 Lits Jumeaux,"3 lits (2 lits simples, 1 grand lit double)","7,7",2 065 expériences vécues,"1 nuit, 1 adulte",,€ 423
Grange Buckingham Hotel,"Camden, Londres",Studio Simple,1 lit simple,"7,5",464 expériences vécues,"1 nuit, 1 adulte",,€ 271
Assembly Covent Garden,"Westminster, Londres",Chambre Double Supérieure sans Fenêtre,1 lit double,"7,9",4 712 expériences vécues,"1 nuit, 1 adulte",,€ 342
Clayton Hotel Chiswick,"Chiswick, Londres",Chambre Double Deluxe,1 lit double,"8,4",4 024 expériences vécues,"1 nuit, 1 adulte",,€ 217
Victoria Studios,"Brent, Londres",Studio avec Canapé-Lit,"2 lits (1 lit double, 1 canapé-lit)","7,9",647 expériences vécues,"1 nuit, 1 adulte",,€ 165
Orlando hotel,"Hammersmith and Fulham, Londres",Chambre Lits Jumeaux Standard,2 lits simples,"6,0",744 expériences vécues,"1 nuit, 1 adulte",,€ 145
Sonder The Henry,"Westminster, Londres",Chambre Simple,1 lit simple,"8,2",2 015 expériences vécues,"1 nuit, 1 adulte",,"€ 289€ 245
-15 %"
Trebovir Hotel,"Kensington et Chelsea, Londres",Chambre Simple,1 lit simple,"7,6",3 698 expériences vécues,"1 nuit, 1 adulte",,€ 279
"The May Fair, A Radisson Collection Hotel, Mayfair London","Westminster, Londres",Chambre Lit Queen-Size Supérieure Collection,1 lit double,"8,1",4 168 expériences vécues,"1 nuit, 1 adulte",,€ 684
Milestone Hotel Kensington,"Kensington et Chelsea, Londres",Chambre Supérieure Lit Queen-Size,1 grand lit double,"9,3",842 expériences vécues,"1 nuit, 1 adulte",,"€ 715€ 643
-10 %"
"100 Queen’s Gate Hotel London, Curio Collection by Hilton","Kensington et Chelsea, Londres",Chambre Lit Queen-Size Deluxe,1 grand lit double,"7,8",2 942 expériences vécues,"1 nuit, 1 adulte",,€ 415
Eurotraveller Hotel - Premier - Tower Bridge,"Southwark, Londres",Chambre Double,1 lit double,"7,5",3 201 expériences vécues,"1 nuit, 1 adulte",,€ 206
Berjaya Eden Park London Hotel,"Westminster, Londres",Chambre Simple Classique,1 lit simple,"5,7",2 340 expériences vécues,"1 nuit, 1 adulte",,€ 168
Adria Hotel,"Hammersmith and Fulham, Londres",Chambre Familiale avec Salle de Bains Privative,"3 lits (2 lits simples, 1 lit double)","8,2",1 563 expériences vécues,"1 nuit, 1 adulte",,€ 191
Hilton London Paddington,"Westminster, Londres",Chambre Double,1 lit double,"7,4",3 436 expériences vécues,"1 nuit, 1 adulte",,€ 325
The Westin London City,"La City, Londres",Chambre King Signature,1 très grand lit double,"8,8",760 expériences vécues,"1 nuit, 1 adulte",,€ 422
Eccleston Square Hotel,"Westminster, Londres",Petite Chambre Lit Queen-Size,1 grand lit double,"8,5",507 expériences vécues,"1 nuit, 1 adulte",,€ 322
Kip Hotel,"Hackney, Londres",Petite Chambre Simple avec Salle de Bains Commune,1 lit simple,"7,4",4 290 expériences vécues,"1 nuit, 1 adulte",,€ 176
Simply Rooms & Suites,"Hammersmith and Fulham, Londres",Suite Studio de Luxe,1 lit double,"7,2",775 expériences vécues,"1 nuit, 1 adulte",,€ 205
Sloane Square Hotel,"Kensington et Chelsea, Londres",Chambre Simple,1 lit simple,"7,8",1 731 expériences vécues,"1 nuit, 1 adulte",,€ 382
Victoria Villas,"Hammersmith and Fulham, Londres",Chambre Simple,Hébergement géré par un particulier,"8,9",202 expériences vécues,"1 nuit, 1 adulte",,€ 99
